review,binary_rating
"Muy céntrico el hotel y sus habitación muy amplias y confortables. Un hotel muy cómodo, servicio excelente. Un descanso sin ninguna molestia y con todas las comodidades para trabajar en la habitación. Sobre la calidad de los alimentos del restaurant siento que le falta un mejor sazón.",1
"Buena la estancia, aunque podría estar mejor ya que las habitaciones se están haciendo viejas, habría que considerar una remodelación. La ubicación es buena así como el servicio del personal. La comida del restaurante también es buena",1
"La ubicación del hotel, las habitaciones y la atención recibida, excelente. Nos hospedamos en familia y tuvimos un evento, todo en el mismo hotel. Esta muy cerca de atractivos turísticos de la ciudad.",1
"buena ubicación, pero el restaurant la comida no era buena y cara, las instalaciones (baño de habitación) ya están algo viejas....el personal es amable, esta en el puro centro historioc de monterrey. taxis muy cerca y transporte",0
"En hotelería de lo mejor que he vivido, la amabilidad del personal y el balance necesario entre calidad de servicio e instalaciones son de destacar, como les comento sin temor a equivocarme ¡ de lo mejor !.......los alimentos son de gran sazón y sabor, las habitaciones con su estilo neo-clásico de lo mejor, les agradezco mucho sus finas atenciones no sin antes reiterar un cordial saludo. Atte: Juan Francisco Uribe L.",1
"excelente hotel, el personal muy amable, y el room service muy rapido, me he quedado tres veces consecutivas durante un mes y todas las veces el servicio fue excelente. solo el vallet parking unn poco lento.",1
"Es el mejor de la zona pero hay que empezar a modernizarlo, y que empieza a verse antiguo, esta bien ubicado y cumple con lo que uno busca para descanzar, el precio por convenio es competitivo y eso ayuda a seleccionarlo, el bar para migusto esta muy pequeño",1
Me gusta hospedarme en este hotel por la cercanía a todos los puntos. La comida es buenísima al igual que el servicio. Al estar en el centro puedes caminar a las partes mas representativas de Monterrey. Ademas de que el personal tiene el conocimiento suficiente para recomendarte lugares y darte indicaciones si es que necesitas algo en especifico. Me gusta mucho este hotel,1
"siempre que me hospedo con ustedes quedo muy satisfecho, esta en muy buena zona turistica y el trato es muy amable. las recompensas de sus programas hace que regrese cada vez mas contento felicidades, seguire siendo su cliente",1
"claro! muchas opiniones es que es un poco viejo, pero no le quita para nada su encanto! no está nada descuidado la amabilidad del staff es muy buena y su ubicación excelente! no duden en escoger este hotel y pedir habitación con vista a la ciudad.",1
"La zona en la que se ubica el hotel es muy conveniente, cerca de todo y bien conectada. El hotel es un hotel muy viejo con poco mantenimiento, las habitaciones son muy grandes pero la que a mi me toco, el aire no servia y hacia ruido como avión, el baño tenía fuga de agua que obvio hacia mucho ruido y muy a pesar que la reporte no hicieron nada. La atención es de regula a mala, estuve en el business center esperando atención por cerca de 40 minutos.",0
"Gracias por hacerme pasar una excelente estancia, desde el call center que me ofreció una tarifa conveniente hasta el personal de recepción muy atento me permitió ocupar anticipadamente la habitación. en general Felicitaciones a todos por hacer un extraordinario trabajo.",1
"el hotel tiene todos los servicios y se siente uno en casa estupenda localizacion,habitaciones amplias,mobiliario exelente atencion personalizada buenos alimentos silencioso para un buen descanso servicio de alimentos y bebidas las 24 horas del dia entre restaurante CAFE FLORES y servicio al cuarto servicio de consergeria excelente y siempre dispuestos para atender al cliente",1
"Amabilidad del servicio bien, area de oportunidad en atención en el restaurant, fumigación del cuarto (habia cucarachas) y atención en detalles de tramite de servicio (no se habilito correctamente mi tarjeta llave)",0
tienes toda la comodidad en tu estancia ademas la promocion que se me dio fue excelente el costo por noche solo me gustaria que incluyera almuerzo y la hora de salida fuera a la 1:00pm o 1:30 pm... y que no deberian de cobrar el estacionamiento pues somos huesped a mi criterio creo que eso no me parecio de ahi en fuera todo lo de as fue excelente el tipo de habitacion y trato del personal,1
internet lentissima y no habia como cargar el celular o computadora. Buena cama y servicio em general. ubicacion muy buena y buen desayuno. Muebles muy antigos no recomendo pues para trabajar esta muy malo,0
"es un hotel ya viejo pero estan muy decentes las habitaciones, la habitacion que me toco estaba muy limpia, el baño limpio, buena regadera, buenas almohadas pero el clima es de un hotel viejo y hace ruido , el servicio de restaurante es bueno, desayunamos mi esposa y yo y quedamos contentos ya que hay todas las frutas y te preparan todo lo que gustes por un precio razonable , lo unico malo de este hotel es la atencion en el checkout , pedi factura, se tardaron mucho y habia un error en los datos de facturacion de forma amable pedi me corrigieran el error y la srta de muy mala gana me comento que el sat se tardaba hasta 2 horas en hacer una cancelacion(si no sabes mejor no digas tonterias) y es hora que sigo esperando la factura despues de 15 dias !!!!",0
"falta de mantenimiento en las habitaciones, el extractor de aire del baño no funcionaba y debiamos dejar abierta la puerta de la habitacion para que saliera el vapor cada vez que nos bañabamos, nunca atendieron nuestra solicitud de arreglarlo a pesar de haberlo reportado durante dos dias",0
"Servicio e instalaciones 100% recomendable, alta higiene en todos sus espacios y muy importante que el hotel este en el mero corazón de la ciudad de Monterrey, excelente vista, restaurente, bar, alberca, gym, etc.",1
"Muy buen lugar, trato amable y muy buen servicio en los alimentos, aunque podría mejorarse parte del mobiliario que se nota como de otra época o que no es acorde a la época actual. así mismo no se especifica si el agua embotellada que esta en las habitaciones es cortesía del hotel o bien tienen costo adicional.",1
"Buen precio si reservas en linea, precios de restaurante extremadamente elevados y la comida no es muy buena. Soy socio fiesta rewards y los beneficios no fueron explicados detalladamente, en la habitacion estaba una hoja donde decia que habia kit de bienvenida y kit de noche por ser socio fiesta rewards pero nunca entendi cuales fueron dichos kits.",1
Necesitan mejorar la atencion y servicio al cliente la comunicacion entre recepcion y cliente fue mala tiene buenos elementos como las instalaciones y la ubicacion e incluso el precio pero la intereccion entre personal y cliente les falta mas comunicaion,0
"Amabilidad, rapidez y limpieza, un excelente servicio, tanto para descanso como para negocios y familiar. Rapidez en el registro tanto de llegada como de salida. Habitaciones limpias, Excelente ubicación",1
Todo el servicio que nos brindan es excelente las instalaciones son de primera la ubicacion muy buena la comida muy rica en general todo esta excelente y no tengo ninguna queja al contrario no dudo nada en recomendarlos ampliamente de nuevo reitero mi agradecimiento y felicitarlos por su buen servicio hasta pronto!!!,1
"Muy buena relacion de precio, ubicacion y servicio. Es de los mejores hoteles en la zona, lo malo es en algunos lados la visita no es buena, las habitaciones bien, quiza alguna partes del mobiliario ya un poco antiguo.",1
"Buen servicio en todos los aspectos, cuartos limpios, buena calidad en la comida, muy buena ubicación, personal muy servicial, experiencia muy satisfactoria. Altamente recomendar su hotel y servicios.",1
"Una sincera felicitacion por la atencion brindada en nuestra estancia en sus instalaciones, definitivamente la mejor experiencia, la habitacion que nos toco (711), la mejor habitacion que hemos recibido en años, excelente vista. El mobiliario, limpieza impecable, asi como la profesionalidad y amabilidad del personal del hotel.",1
"Muy satisfecho con mi estancia en el Hotel Fiesta Américana en el centro de la ciudad de Monterrey, desde la calidez y eficiencia en el servicio del personal, la rápida solución, la comodidad y excelente calidad de sus instalaciones; convirtieron un sencillo viaje trabajo en una muy placentera experiencia.",1
"Servicio y atención son excelentes desde mi percepción de usuario pues atienden de inmediato las solicitudes de servicio, reservaciones, etc. con un toque personal. El costo de hotel es completamente competitivo y por la ubicación lo convierte en un hotel excelente para negocios o en familia",1
"Muy buen hotel con excelente ubicación, totalmente céntrico conveniente a la macroplaza y una serie de opciones de restaurant en los alrededores. Impresiona el area de lobby del hotel, los elevadores funcionan en excelente tiempo, los cuatos son muy grandes pero un poco antiguas.",1
"desde nuestra llegada el personal nos trato increíble, todo estuvo supero bien, la vista de la habitación en el piso 9 increíble, la ubicación del hotel excelente. mi esposa y yo pasamos un fin de semana increíble muchas gracias",1
"Su lobby esta muy bonito, buen trato del personal, pero sus instalaciones tanto en pasillos como habitación, se me hicieron muy viejas y el mantenimiento que le han dado no ha sido suficiente ya que han descuidado los detalles, buena ubicación para turista.",0
"Muy buena ubicación y excelente servicio. El personal muy atento, ademas de estar al pendiente de sus clientes. Muy recomendable para descanso en pareja o en familia. Esta muy cómodo por la ubicación en el centro de monterrey y acceso a restaurantes y comercios.",1
"Mala atención en recepción y restaurante bufet, apagadores mal posicionados, falta de luz en habitación, bufet insuficiente para la cantidad de huespedes, mala atención del personal del restaurante, losa sucia e insuficiente",0
"Les agradezco todo el servicio estuvo de maravilla, el personal muy amable y eficiente. Sólo en lo personal le falta más espacio al GYM y equipo. el personal de restaurante todos muy atentos y amables. los cuartos limpios.",1
la actitud de servicio y buen trato en muy buenas instalaciones en lugar centrico para cubrir todos los servicios que se requieran durante la estancia en la cd de monterrey nuevo leon. buens dispocision del personal y atencion calida y amable,1
"Estrategicamente, en buen lugar, pero el estacionamiento muy chico, las areas comunes, sucias la periferia, sucia, la atención adecuada pero hasta ahí, muy despersonalizadas, aunque es la misma cadena de los fiesta, los demas es mucho mejor",0
"Mi estancia, en este hotel fue realmente placentera, todo el personal muy amable siempre al pendiente. Las habitaciones muy bien arregladas, una bonita vista 100% recomendable por supuesto que volvería.",1
"La ubicación es muy buena, se localiza a unas cuadras del Barrio Antiguo donde hay bares, restaurantes para ir en la noche a tomar algo. El personal es muy amable y eficiente. El hotel esta en buenas condiciones.",1
"De los mejores lugares, con el mejor servicio. Lugar cercano al centro de la ciudad, muchos lugares que visitar, puedes apoyarte en la gente del Hotel para recomendarte lugares. Cuenta con excelente restaurante, gimnasio y alberca.",1
"La atención del personal es muy buena, pero el hotel ya requiere de una modernización. Aunque las habitaciones son muy amplias, el mobiliario ya es viejo. El internet es lento y llega a trabarse. Los enchufes eléctricos son pocos y algunos no funcionan. Los elevadores son lentos. En general la atmósfera del hotel se percibe como un hotel viejo, con poca luz. La limpieza es adecuada y se nota que hacen un esfuerzo con el mantenimiento, pero llega un punto donde ya se requiere una remodelación a fondo.",0
"El hotel cuenta con áreas muy hermosas, el lobby bar, la recepción pero lo mejor es la ubicación del hotel. Tienes muchos atractivos de Monterrey a cuestión de pasos, además la vista que ofrece el edificio es muy hermosa.",1
"El hotel está bien ubicado en el centro de la ciudad, pero se ve y siente ""viejo"", ya deben remodelarlo. El internet es lento, los enchufes de la habitación son pocos y algunos no funcionan. Los elevadores son lentos. En pocas palabras, fue como hacer un viaje a los años 70s.",0
"Me gusto la estancia, el lugar es centrico, lugar limpio y confortable, lo unico que siento que le falto es incluir maquinas de hielo y maquinas de refrescos y botanas en algun lugar de los pisos o en el lobby para evitar estar saliendo del hotel para comprarlas.",1
muy bonito el hotel le doy 5 estrellas y esta en centro de ciudad no es dificil encontrar el hotel ya q queda en el centro historico y aparte los casinos muy cerca el bosque magico el zologico plaza sesamo,1
"el servicio que dan es de buena calidad con el personal de restaurante, recepción, mantenimiento, limpieza, camareras e instalaciones son dignas de recomendar para una nueva visita. agradezco sus atenciones y amabilidad.",1
"llevo 15 años hospedandome regularmente en este hotel, es un icono en la ciudad,cerca de todo y facil acceso a la ciudad y macroplaza  a pesar de los años, el hotel ha permanecido, el sistema de fiesta rewards es una garantia en cuanto a puntos acumulables, el restaurant excelente,la alberca techada y climatizada  recomendable al 100%",1
"Buenas instalaciones, atención esmerada, tarifas de Internet mucho mejores que las rack, mucha higiene, alimentos con buena sazón , deben mejorar la conexión wi-fi y el señalamiento al acceso, pues se encuentra un poco escondido entre otras edificaciones , lo recomiendo",1
"Lugar excelente para descansar por la comodidad de sus camas y almohadas, tiene una excelente ubicación para trasladarte a cualquier lugar de la ciudad. Sin duda la mejor relación costo beneficio que hay.",1
"El hotel esta bien ubicado, muy limpio y el personal es muy amable. EL restaurant es bueno sin embargo el bufette le falta mejorar. Es un hotel mas de negocios que de viaje de descanso. buena relaci´pon valor - precio.",1
"Estuve por motivos de negocios, la verdad, muy buen hotel, buena atención instalaciones comodas y limpias.  Buena relación entre el precio y los servicios.  De las instalaciones leí varias criticas, sobre que es un hotel viejo, lo es pero esta bien conservado y tiene muy buena ubicación.  La verdad lo recomiendo y en lo personal regreso nuevamente.  La comida aceptable pero suceptible a mejorar",1
"Para los viajes de negocios este hotel te brinda muy buena ubicación, comodidad y excelentes servicios. A pesar de ser un Hotel ya con sus años, no dejan caer la calidad de los cuartos lo cual es destacable.",1
"Por la atencion del personal, la atencion es¿n restaurante es excelente, la facturacion en restaurante es excelente, la variedad de alimentos y bebidas es grande, y los alimentos son ricos, la fruta es fresca y de calidad, la atencion y amabilidad de todo el personal es excelente",1
"la calidad del servicio es bueno, la atención excelente, la limpieza estuvo bien, el detalle es que a veces los elevadores no funcionaban bien, el centro de negocios bien, el gimnasio esta de lujo, el espacio de la alberca es muy pequeño",1
"Estoy muy molesta con el hotel debido a que no les importan los huéspedes, y no hacen nada por tener un buen servicio, y es una lastima ya que el hotel esta muy bien ubicado y el edificio aunque es antiguo es muy bonito, pero como es posible que dejen herramientas, escaleras, domos abiertos, y pintura, sin que estén trabajando, y cuando uno les hace las observaciones no les importe y despues solo se limiten a decir PERDON, sin interesarse por lo que el huésped sienta, además las bebidas son HORRIBLES, y los meseros tienen una actitud de molestia. Además había unos CONDONES en el cuarto (como MOTEL de PASO) en los cajones. Fue muy mala la experiencia que pase, pues iba en plan FAMILIAR, con mis hijos, y no les intereso dar SERVICIO, solo cobrar. Ojala se interesen más por agradar al huésped y hacer su estancia más agradable y especial, pues no hay relación PRECIO, CALIDAD. Y debería revisar su lema porque NO TIENEN LA MAGIA, ni nada de lo que se hace referencia en su mercadotecnia, y eso que piensan abrir 2 hoteles de calidad VIP en Monterrey, pero en lo que más adolecen es en el SERVICIO.",0
"El hotel se encuentra localizado en el área de la macroplaza de monterrey, los museos mas importantes se encuentran cercas y varios de los lugares mas concurridos de monterrey también, es bueno para salir a caminar de noche y se ve perfecto la vista de la ciudad de monterrey desde la habitación.",1
"Excelente relación calidad - precio, muy bien ubicado, lo recomiendo tanto para viajes de negocios como familiares, excelentes habitaciones y el buffete muy variado. Personal atento, . Tienen servicio a cuartos las 24 hrs.",1
"Pesima atención, pedimos servicios de alimentos en buffet de desayuno, alberca con olor a agua de caño, atención de personal pésima en recepción, lo mejor el botones y el personal de estacionamiento. La cortesía al cliente aquí no la conocen.",0
"reconocimiento al servicio aplicado hacia el huesped, pues me hicieron comoda y agradable la estancia en este hote, si llegan a ir busquen a mario, juan o cayertano, muy excelentes meseros asi como el gerente Fenando",1
"Comenzando por un deficiente y grosero servicio de valet parking (no es el mejor lugar para llegar o salir rápido), la experiencia decepcionante desde la recepción, hasta la habitación, se salva por el trato amable del botones.    En la habitación, encontramos múltiples detalles que hicieron realmente incomoda nuestra estancia.    Es una lástima que una franquicia de tanto renombre en México descuide de tal modo sus instalaciones y el lugar de crecer, simplemente envejezca.",0
"La estancia en este hotel fue excelente, dado que se encuentra bien ubicado y las habitaciones son muy confortables, sin ruido y limpias. El precio pagado justifica las comodidades encontradas. Ampliamente recomendable",1
"Aunque corta, la estancia fue agradable. El trato por parte del personal en recepción puede mejorar muchísimo, restaurante y bell boys se portaron de manera excepcional. La ubicación del hotel es inmejorable. La alberca es muy pequeña.",0
"Muy buena calidad de alimentos, y excelente calidéz de servicio. Tiene una muy buena ubicación para poderte mover a las distintas atracciones del lugar, los taxis del hotel no muy caros y disponibles en todo el dia y la noche. En general excelente hotel para hospedarse.",1
muy buen hotel muy comodo centrico facil de llegar muy cercano a los mejores lugares de monterrey macro plaza paseo santa lucia parque fundidora solo es algo caro en los alimentos de todo lo de mas esta muy bien porque esta en el corazon de la ciudad,1
"Excelente ubicacion, muy buen servicio coordiales y su alberca es techada y todo esta a distancia de a pie,tiene una muy buena vista hacia la Macroplaza,les recomiendo hospedarse en su proxima visita a Monterrey.",1
"Para haber sido un estancia rápida fue bastante reconfortante, servicio y atención inmediata y sobre todo la amabilidad del personal. La ubicación más que perfecta para pasear en el Centro de la ciudad, cumple las espectativas para un buen alojamiento.",1
"Instalaciones hermosas, gran servicio, céntrico ya que esta a media calle de la macroplaza, vale cada peso. Recomiendo ampliamente su SERVICIO ya que cada uno de los empleados hace todo por hacerte sentir como en CASA y consentido",1
"Excelente estancia, apoyo en en todos los detalles para hacer de la velada en pareja una gran experiencia. El servicio, atención alimentos excelentes. Un lugar muy recomndable para hospedarse por cualquiera que sea la razon de su viaje",1
"Uno de los Hoteles cercanos al Centro y con excelente ubicacion en Monterrey, con instalaciones comodas, las habitaciones son confortables, ademas el desayuno que te ofrecen en la mañana esta super completo y el sabor y calidad de los alimentos son buenos",1
Muy buen servicio y atencion al cliente. Tuve problemas con mi tarjeta en el check in y recibi total comprension y atencion por parte del personal de recepcion. Sin tener que preocuparme me atendieron como si no hubiera tenido problemas para dejar el baucher abierto,1
mi casa en monterrey excelente servicio y atencion se siente uno muy agusto y seguro en todos los aspectos muy centrico todos los servicios estan a la mano bancos comercios de todo tipo eventos agradables en la plaza hidalgo,1
"Como les comentamos anterior mente RECOMENDAMOS A HECTOR RODRIGUEZ. NOS ATENDIO EXCELENTE MENTE .tambien recomendamos a las camareras ya que tienen una excelente atencion , educacion y sobretodo limpieza GRACIAS.",1
"la verdad fue una estancia muy agradable , con toda la comodid que uno quiere tener, la alberca ,sauna, clima, y sus alimentos , realmente estubieron excelente , me gusta mucho hospedarme en este hotel cada ves que voy a monterrey",1
"Le falta actualizar la imagen del Hotel, le falta jovialidad, es un estilo muy serio, la atención del personal es bueno, pero las alformbras y todo el mobiliario le hace falta un poco de modernidad, cuenta con todas las amenidades, el descanso fue bueno en general, su ubicación es buena, este hotel es mas de negocios por el enfoque de la linea.",1
"muy elegantes desde que entras, lobby, recepcion, bar, elevador... absolutamente todo. me gusto la habitacion. la vista desde la 916 es increible, lucesapagadas cortinas abiertas.. es un panorama que me llevo.. ninguna de las fotos que tome refleja la verdadera belleza de la vista muchas gracias",1
"Excelente lugar para trabajar, la atención es de elegante ejecución y muy agradable espacio para reunirte con propósitos de negocio. La Comida es común paro el silencio y lo cómodo de la habitación, valen su precio",1
"Tengo muchos años ue este hotel es mi preferido en monterrey , ya que por la Calidez del personal me siento como en casa . Adicionalmente hay excelente atención y servicio del personal de Recepción , Restaurant y botones. Otro punto relevante es su ubicación centrica y muy cerca de la Macroplaza , Museos , Paseo Santa Lucía , sitios que puedes visitar caminando.",1
"Me gusto aun que un poco clasico para mi gusto¡ debrian remodelarlo y hacerlo mas moderno, en general todo bien y puedo entender que por estar en el centro historico todo esta bien y en orden¡ las instalciones y todo en oreden",1
"me parece que no es un hotel de 5 estrellas y lo venden como tal me pareció que esta sobrevaluado, las habitaciones esta en mediano estado los boxsprings se estan deshaciendo por abajo no quiero pensar en los colchones, en fin todo muy viejo",0
"Primero que nada la ubicacion es excelente si quieres turistear en Monterrey  A unos pasos de la macroplaza te puedes desplazar a muchos lados cercanos de interes , como el Marco, Paseo Santa Lucia y parque fundidora. En cuanto el hotel cabe destacar la atencion del personal , son muy muy amables y atentos a cualquier necesidad; las habitaciones son muy amplias y pudimos descansar de maravilla, la vista es muy bonita y mas de noche se aprecia la ciudad muy bien. El unico punto a mejorar es el moiliario que es un poco viejo pero no es tan malo, cuando tenga oportunidad regresare.",1
"Este hotel tiene una muy buena ubicación dentro del centro de Monterrey, las habitaciones son tienen un muy buen espacio, tal vez algo caro pero es por los hoteles que están cerca de su ubicación. Si tienen la posibilidad de pagarlo anímense.",1
"Excelente trato de todo el personal, buenas instalaciones y servicio eficiente. La ubicación del hotel esta en pleno centro de la Cd.de Monterrey. La calidad de los alimentos en el restauranye es muy buena y muy variada.",1
"Buen servicio por parte del personal. Solo falta mejorar accesorios de los cuartos ( burro de planchar, tapete antideslizante). Algunos canales no se ven bien. EL servicio de internet es rápido y las habitaciones están limpias. Es el hotel ideal para negocios en Monterrey",1
"Es un hotel muy centrico en la ciudad, con un diseño arquitectonico de primera... sus habitaciones muy confortables y el servicio del personal de primera calidad, El restaurante muy limpio y los alimentos muy sabrosos y deliciosos, totalmente reconmedable. el trato del personal hacia los huespedes, muy respetuoso y amables. Gracias",1
"El hotel esta ubicado en la zona centrica de la Ciudad, así que es muy comodo para salir y andar turisteando por la zona, para tomar el paseo santa Lucia, llegas caminando por la macro plaza, pasar el día en el parque la fundidora, tomas de vuelta la lanchita y llegas al hotel, es la gran ventaja, el hotel es una construcción vieja como muchos alrededor pero tiene la básico y si tu plan es llegar a dormir es suficiente. El precio del bufet me parecio caro y poco variado pero puedes desayunar en otro lugar.",0
"la verdad tuve un a mala experiencia en este hotel. ademas de que el hotel ya es muy viejo esta bastante incomodo en general.  lo que si es deplorable es el restaurante, la comida que dan ahí es de lo mas malo que he probado en mi vida ademas de ser muy caro.  tuve algunos mal entendidos con la gente del hotel ya que me hicieron el check out antes de que lo pidiera.  lo unico que si tiene bueno es la atención del personal. eso si es excelente.",0
